{
  "symbol": "BTC",
  "name": "Bitcoin",
  "decimals": 8,
  "logoURI": "https://cdn.jsdelivr.net/gh/rome-protocol/registry@v0.1.0/assets/btc.svg",
  "description": "Native asset of the Bitcoin network. Tracked here as a price reference; no canonical Rome-side wrapper yet.",
  "homepage": "https://bitcoin.org",
  "tags": ["layer1"]
}
